{
  "id":"autumn-quiz","name":"Осенний турнир знаний","description":"Демонстрация накопления баллов.","max_players":128,
  "entry":{"type":"free","ticket_id":""},
  "rounds":[{"number":1,"name":"Разминка","description":"Пять коротких вопросов.","duration_minutes":10,"rules":{"attempt_limit":1,"score_aggregation":"best"}}],
  "rewards":[{"place":1,"type":"points","amount":100}],"tie_policy":"shared_place_full_reward"
}
